<?xml version="1.0" encoding="UTF-8" standalone="no"?>
<notes xmlns="http://www.epam.tc.com/notes"
       xmlns:xsi="http://www.w3.org/2001/XMLSchema-instance"
       xsi:schemaLocation="http://www.epam.tc.com/notes ./notes.xsd">

    <note id="1">
        <to>Vasya</to>
        <сustomer-location>UK</сustomer-location>
        <from>Sveta</from>
        <heading>Napominanie</heading>
        <body>Pozvoni</body>
    </note>

    <note id="2">
        <to>Вася</to>
        <сustomer-location/>
        <from>Света</from>
        <heading>Напоминание</heading>
        <body>Позвони мне завтра!</body>
    </note>

</notes>